{
  "schema_version": 1,
  "policy": "docs/geographic-applicability.md",
  "components": {
    "skill:agreement": "portable",
    "skill:architecture-knowledge": "us-explanation",
    "skill:color-palette-generator": "portable",
    "skill:csv-to-sif": "portable",
    "skill:demographics-analysis": "site-research",
    "skill:environmental-analysis": "site-research",
    "skill:epd-compare": "portable",
    "skill:epd-parser": "portable",
    "skill:epd-research": "portable",
    "skill:epd-to-spec": "portable",
    "skill:invoice": "portable",
    "skill:learn": "portable",
    "skill:master-schedule": "portable",
    "skill:meeting-minutes": "portable",
    "skill:mobility-analysis": "site-research",
    "skill:nyc-acris": "nyc-records",
    "skill:nyc-bsa": "nyc-records",
    "skill:nyc-dob-permits": "nyc-records",
    "skill:nyc-dob-violations": "nyc-records",
    "skill:nyc-hpd": "nyc-records",
    "skill:nyc-landmarks": "nyc-records",
    "skill:nyc-property-report": "nyc-records",
    "skill:occupancy-calculator": "jurisdiction-calculation",
    "skill:product-audit": "portable",
    "skill:product-cut-sheet": "portable",
    "skill:product-data-cleanup": "portable",
    "skill:product-data-import": "portable",
    "skill:product-enrich": "portable",
    "skill:product-image-processor": "portable",
    "skill:product-library": "portable",
    "skill:product-match": "portable",
    "skill:product-pair": "portable",
    "skill:product-research": "portable",
    "skill:product-spec-bulk-fetch": "portable",
    "skill:product-spec-pdf-parser": "portable",
    "skill:project": "portable",
    "skill:proposal": "portable",
    "skill:resize-images": "portable",
    "skill:sif-to-csv": "portable",
    "skill:site-history": "site-research",
    "skill:site-visit-report": "portable",
    "skill:skill-maker": "portable",
    "skill:slide-deck-generator": "portable",
    "skill:ffe-spec-book": "portable",
    "skill:spec-writer": "portable",
    "skill:studio": "portable",
    "skill:studio-feedback": "portable",
    "skill:tasklist": "portable",
    "skill:timetracker": "portable",
    "skill:tool-catalog": "portable",
    "skill:workplace-programmer": "portable",
    "skill:workplan": "portable",
    "skill:zoning-analysis-nyc": "nyc-zoning",
    "skill:zoning-envelope": "input-report",
    "tool:plugin-namespace": "portable",
    "tool:category-validation": "portable",
    "tool:source-health": "source-health",
    "tool:ffe-records": "portable",
    "tool:ffe-intake": "portable",
    "tool:ffe-audit": "portable",
    "tool:document-contracts": "portable",
    "tool:ffe-outputs": "portable",
    "tool:host-contract-validator": "portable",
    "tool:product-library": "portable",
    "tool:product-observations": "portable",
    "tool:geographic-applicability": "portable",
    "tool:product-url-clip": "portable",
    "skill:product-url-clip": "portable",
    "skill:drawing-quantity-extract": "portable",
    "skill:schedule-quantity-reconcile": "portable",
    "skill:lighting-report-extract": "portable",
    "tool:pdf-evidence": "portable",
    "tool:dimension-values": "portable",
    "tool:drawing-quantities": "portable",
    "tool:schedule-reconcile": "portable",
    "tool:delivery-coverage": "portable",
    "tool:lighting-report": "portable",
    "tool:product-identity": "portable",
    "tool:capability-metadata": "portable",
    "skill:norma": "portable",
    "tool:assistant-preference": "portable",
    "skill:receive": "portable",
    "tool:local-runner": "portable",
    "tool:workbook-preservation": "portable",
    "skill:norma-support": "portable"
  },
  "references": [
    {
      "path": "corpus/sources/catalog.json",
      "authority": null,
      "jurisdiction": null,
      "spatial_coverage": "Each source declares its jurisdiction; shared sources use null. Filter the US, state and municipality parent chain independently of practice clusters.",
      "edition": null,
      "effective_date": null,
      "limitation": "Navigation metadata only. Retrieve and verify original material for the task location, analysis date, edition and scope; a link or successful fetch is not applicability evidence."
    }
  ]
}
